{
  "id": "sleeping",
  "name_vi": "Ngủ",
  "description_vi": "Người dùng nằm trên giường, bàn trống và ánh sáng thấp.",
  "duration_minutes": 480,
  "actions": [
    {"at_minute": 0, "target": "occupancy.room_present", "value": true},
    {"at_minute": 0, "target": "occupancy.bed_occupied", "value": true},
    {"at_minute": 0, "target": "occupancy.desk_occupied", "value": false},
    {"at_minute": 0, "target": "power.computer_power_watts", "value": 0},
    {"at_minute": 0, "target": "devices.main_light", "value": {"power": false, "brightness_percent": 0, "color_temperature_kelvin": 3000}},
    {"at_minute": 0, "target": "devices.bedside_light", "value": {"power": true, "brightness_percent": 5, "color_temperature_kelvin": 2800}},
    {"at_minute": 0, "target": "inferred_context", "value": "sleeping"}
  ]
}
